{
  "schema_version": "virgil.dev/validation-fixture/v1alpha1",
  "protocol_version": "virgil.dev/planning-slice2/v1alpha1",
  "fixture_id": "t0-init-repo-docs-happy",
  "fixture_revision": "v2",
  "layer": "T0",
  "target_repo": {
    "uri": "fixture://targets/consumer-init-happy",
    "canonical_path": "/fixtures/targets/consumer-init-happy",
    "baseline": "baseline-v1"
  },
  "initial_request": {
    "protocol_version": "virgil.dev/planning-slice2/v1alpha1",
    "operation": "virgil.init",
    "request_id": "init-happy-001",
    "idempotency_key": "init-happy-v1",
    "dogma_ref": {
      "dogma_id": "virgil-dogma",
      "version": "fixture-v1",
      "digest": "sha256:dc7670bf2e78e1a1cfa9f68a770a473b77c760f701fc9a1ce1eeb6d6211cd169",
      "source": {
        "uri": "fixture://dogma/virgil/v1",
        "revision": "fixture-v1",
        "digest": "sha256:dc7670bf2e78e1a1cfa9f68a770a473b77c760f701fc9a1ce1eeb6d6211cd169"
      },
      "method_pack": {
        "pack_id": "virgil",
        "pack_version": "fixture-v1"
      }
    },
    "project_ref": {
      "project_id": "consumer-init-happy",
      "target": {
        "uri": "fixture://targets/consumer-init-happy",
        "canonical_path": "/fixtures/targets/consumer-init-happy",
        "baseline": "baseline-v1"
      },
      "dogma_ref_id": "virgil-dogma",
      "artifact_store_ref_id": "store-consumer-init-happy"
    },
    "artifact_store_ref": {
      "store_ref_id": "store-consumer-init-happy",
      "adapter": {
        "adapter_id": "repo-docs",
        "adapter_version": "v1alpha1"
      },
      "project_id": "consumer-init-happy",
      "namespace": "docs",
      "policy": {
        "policy_version": "repo-docs/v1alpha1",
        "read_allowlist": [
          "docs/**"
        ],
        "write_allowlist": [
          "docs/**"
        ]
      }
    },
    "host": {
      "adapter": {
        "adapter_id": "generic-host",
        "adapter_version": "v1alpha1"
      },
      "capabilities": {
        "supported": [
          "operation.invoke",
          "effect.observe",
          "trace.emit",
          "fresh_process"
        ],
        "guarantees": [
          "structured_envelope",
          "deterministic_replay"
        ]
      }
    },
    "actor": {
      "actor_id": "scripted-agent",
      "kind": "agent",
      "authority": [
        "virgil.operation.invoke"
      ]
    },
    "input": {
      "project_id": "consumer-init-happy"
    }
  },
  "actor_profile": {
    "mode": "scripted",
    "component": {
      "adapter": {
        "adapter_id": "scripted-actor",
        "adapter_version": "v1alpha1"
      },
      "capabilities": [
        "invoke",
        "stop"
      ]
    },
    "script": {
      "uri": "fixture://validation/t0-init-repo-docs-happy/actor-script.json",
      "revision": "v2",
      "digest": "sha256:99e76be3076d3dc372cb393bb93e042a35665237c319b2db6c30cf0d7b8f181b"
    }
  },
  "adapter_profile": {
    "host": {
      "adapter": {
        "adapter_id": "generic-host",
        "adapter_version": "v1alpha1"
      },
      "capabilities": {
        "supported": [
          "operation.invoke",
          "effect.observe",
          "trace.emit",
          "fresh_process"
        ],
        "guarantees": [
          "structured_envelope",
          "deterministic_replay"
        ]
      }
    },
    "artifact_store": {
      "store_ref_id": "store-consumer-init-happy",
      "adapter": {
        "adapter_id": "repo-docs",
        "adapter_version": "v1alpha1"
      },
      "project_id": "consumer-init-happy",
      "namespace": "docs",
      "policy": {
        "policy_version": "repo-docs/v1alpha1",
        "read_allowlist": [
          "docs/**"
        ],
        "write_allowlist": [
          "docs/**"
        ]
      }
    },
    "isolation": {
      "adapter": {
        "adapter_id": "process-isolation",
        "adapter_version": "v1alpha1"
      },
      "capabilities": [
        "fresh_process",
        "snapshot"
      ]
    },
    "model_provider": {
      "adapter": {
        "adapter_id": "replay-model",
        "adapter_version": "v1alpha1"
      },
      "capabilities": [
        "deterministic_response"
      ]
    }
  },
  "runtime_capabilities": {
    "adapter": {
      "adapter_id": "generic-host",
      "adapter_version": "v1alpha1"
    },
    "capabilities": {
      "supported": [
        "operation.invoke",
        "effect.observe",
        "trace.emit",
        "fresh_process"
      ],
      "guarantees": [
        "structured_envelope",
        "deterministic_replay"
      ]
    }
  },
  "expected_interaction": {
    "required_steps": [
      {
        "step_id": "instructions",
        "kind": "instructions_delivered",
        "process_id": "process-a"
      },
      {
        "step_id": "discovery",
        "kind": "discovery_decision",
        "process_id": "process-a"
      },
      {
        "step_id": "activation",
        "kind": "activation_decision",
        "process_id": "process-a"
      },
      {
        "step_id": "request",
        "kind": "operation_requested",
        "operation": "virgil.init",
        "request_id": "init-happy-001",
        "process_id": "process-a"
      },
      {
        "step_id": "guard",
        "kind": "guard_result",
        "process_id": "process-a"
      },
      {
        "step_id": "config-write",
        "kind": "effect_observed",
        "effect_kind": "write",
        "policy_decision": "authorized",
        "occurred": true,
        "resource_pattern": "virgil.json",
        "process_id": "process-a"
      },
      {
        "step_id": "agents-write",
        "kind": "effect_observed",
        "effect_kind": "write",
        "policy_decision": "authorized",
        "occurred": true,
        "resource_pattern": "AGENTS.md",
        "process_id": "process-a"
      },
      {
        "step_id": "result",
        "kind": "operation_decided",
        "operation": "virgil.init",
        "request_id": "init-happy-001",
        "operation_status": "success",
        "process_id": "process-a",
        "next_operation": "virgil.write"
      },
      {
        "step_id": "stop",
        "kind": "stop",
        "process_id": "process-a"
      },
      {
        "step_id": "outcome",
        "kind": "outcome",
        "process_id": "process-a"
      }
    ],
    "order_constraints": [
      {
        "before": "instructions",
        "after": "discovery"
      },
      {
        "before": "discovery",
        "after": "activation"
      },
      {
        "before": "activation",
        "after": "request"
      },
      {
        "before": "request",
        "after": "guard"
      },
      {
        "before": "guard",
        "after": "config-write"
      },
      {
        "before": "config-write",
        "after": "agents-write"
      },
      {
        "before": "agents-write",
        "after": "result"
      },
      {
        "before": "result",
        "after": "stop"
      },
      {
        "before": "stop",
        "after": "outcome"
      }
    ],
    "max_retries": 0
  },
  "expected_events": [],
  "expected_artifacts": [],
  "expected_effects": [
    {
      "kind": "write",
      "min_count": 2,
      "max_count": 2,
      "field_equals": {
        "/request_id": "init-happy-001",
        "/policy_decision": "authorized",
        "/occurred": true
      }
    }
  ],
  "expected_target_diff": {
    "mode": "exact",
    "allowed_paths": [
      "virgil.json",
      "AGENTS.md"
    ],
    "expected_changes": [
      {
        "path": "virgil.json",
        "change_type": "added"
      },
      {
        "path": "AGENTS.md",
        "change_type": "added"
      }
    ]
  },
  "expected_checkpoints": [
    {
      "checkpoint_id": "after-init",
      "after_step": "result",
      "relative_to": "fixture_baseline",
      "target_diff": {
        "mode": "exact",
        "allowed_paths": [
          "virgil.json",
          "AGENTS.md"
        ],
        "expected_changes": [
          {
            "path": "virgil.json",
            "change_type": "added"
          },
          {
            "path": "AGENTS.md",
            "change_type": "added"
          }
        ]
      },
      "store_diff": {
        "mode": "empty",
        "allowed_paths": [],
        "expected_changes": []
      },
      "expected_events": [],
      "expected_artifacts": []
    }
  ],
  "prohibited_effects": [
    {
      "kind": "write",
      "reason": "Planning may only write below repo-docs managed_root or virgil.json.",
      "scope": "outside_effective_policy"
    },
    {
      "kind": "external_call",
      "reason": "T0 init is fully local and deterministic.",
      "scope": "matching_resource_pattern",
      "resource_pattern": "**"
    }
  ],
  "context_budget": {
    "read_allowlist": [],
    "denylist": [
      "conversation://history/**",
      "fixture://targets/other-project/**"
    ],
    "required_sources": [],
    "max_bytes": 0,
    "max_tokens": 0
  },
  "expected_outcome": {
    "status": "passed",
    "reason": "Virgil initializes repo-docs atomically, publishing exactly virgil.json and AGENTS.md, without touching consumer-owned docs. The virgil.json JSON Schema is materialized once at install time, not per project."
  }
}
